{
  "map_name": "large_20_territories",
  "dimensions": {"x": 8, "y": 5},
  "territories": {
    "0": {
      "id": 0,
      "name": "Alpha",
      "tiles": [{"x": 0, "y": 0}, {"x": 1, "y": 0}],
      "adjacencies": [1, 4],
      "border": [
        {"start": {"x": 0, "y": 0}, "end": {"x": 2, "y": 0}},
        {"start": {"x": 2, "y": 0}, "end": {"x": 2, "y": 1}},
        {"start": {"x": 2, "y": 1}, "end": {"x": 0, "y": 1}},
        {"start": {"x": 0, "y": 1}, "end": {"x": 0, "y": 0}}
      ]
    },
    "1": {
      "id": 1,
      "name": "Beta",
      "tiles": [{"x": 2, "y": 0}, {"x": 3, "y": 0}],
      "adjacencies": [0, 2, 5],
      "border": [
        {"start": {"x": 2, "y": 0}, "end": {"x": 4, "y": 0}},
        {"start": {"x": 4, "y": 0}, "end": {"x": 4, "y": 1}},
        {"start": {"x": 4, "y": 1}, "end": {"x": 2, "y": 1}},
        {"start": {"x": 2, "y": 1}, "end": {"x": 2, "y": 0}}
      ]
    },
    "2": {
      "id": 2,
      "name": "Gamma",
      "tiles": [{"x": 4, "y": 0}, {"x": 5, "y": 0}],
      "adjacencies": [1, 3, 6],
      "border": [
        {"start": {"x": 4, "y": 0}, "end": {"x": 6, "y": 0}},
        {"start": {"x": 6, "y": 0}, "end": {"x": 6, "y": 1}},
        {"start": {"x": 6, "y": 1}, "end": {"x": 4, "y": 1}},
        {"start": {"x": 4, "y": 1}, "end": {"x": 4, "y": 0}}
      ]
    },
    "3": {
      "id": 3,
      "name": "Delta",
      "tiles": [{"x": 6, "y": 0}, {"x": 7, "y": 0}],
      "adjacencies": [2, 7],
      "border": [
        {"start": {"x": 6, "y": 0}, "end": {"x": 8, "y": 0}},
        {"start": {"x": 8, "y": 0}, "end": {"x": 8, "y": 1}},
        {"start": {"x": 8, "y": 1}, "end": {"x": 6, "y": 1}},
        {"start": {"x": 6, "y": 1}, "end": {"x": 6, "y": 0}}
      ]
    },
    "4": {
      "id": 4,
      "name": "Echo",
      "tiles": [{"x": 0, "y": 1}, {"x": 1, "y": 1}],
      "adjacencies": [0, 5, 8],
      "border": [
        {"start": {"x": 0, "y": 1}, "end": {"x": 2, "y": 1}},
        {"start": {"x": 2, "y": 1}, "end": {"x": 2, "y": 2}},
        {"start": {"x": 2, "y": 2}, "end": {"x": 0, "y": 2}},
        {"start": {"x": 0, "y": 2}, "end": {"x": 0, "y": 1}}
      ]
    },
    "5": {
      "id": 5,
      "name": "Foxtrot",
      "tiles": [{"x": 2, "y": 1}, {"x": 3, "y": 1}],
      "adjacencies": [1, 4, 6, 9],
      "border": [
        {"start": {"x": 2, "y": 1}, "end": {"x": 4, "y": 1}},
        {"start": {"x": 4, "y": 1}, "end": {"x": 4, "y": 2}},
        {"start": {"x": 4, "y": 2}, "end": {"x": 2, "y": 2}},
        {"start": {"x": 2, "y": 2}, "end": {"x": 2, "y": 1}}
      ]
    },
    "6": {
      "id": 6,
      "name": "Golf",
      "tiles": [{"x": 4, "y": 1}, {"x": 5, "y": 1}],
      "adjacencies": [2, 5, 7, 10],
      "border": [
        {"start": {"x": 4, "y": 1}, "end": {"x": 6, "y": 1}},
        {"start": {"x": 6, "y": 1}, "end": {"x": 6, "y": 2}},
        {"start": {"x": 6, "y": 2}, "end": {"x": 4, "y": 2}},
        {"start": {"x": 4, "y": 2}, "end": {"x": 4, "y": 1}}
      ]
    },
    "7": {
      "id": 7,
      "name": "Hotel",
      "tiles": [{"x": 6, "y": 1}, {"x": 7, "y": 1}],
      "adjacencies": [3, 6, 11],
      "border": [
        {"start": {"x": 6, "y": 1}, "end": {"x": 8, "y": 1}},
        {"start": {"x": 8, "y": 1}, "end": {"x": 8, "y": 2}},
        {"start": {"x": 8, "y": 2}, "end": {"x": 6, "y": 2}},
        {"start": {"x": 6, "y": 2}, "end": {"x": 6, "y": 1}}
      ]
    },
    "8": {
      "id": 8,
      "name": "India",
      "tiles": [{"x": 0, "y": 2}, {"x": 1, "y": 2}],
      "adjacencies": [4, 9, 12],
      "border": [
        {"start": {"x": 0, "y": 2}, "end": {"x": 2, "y": 2}},
        {"start": {"x": 2, "y": 2}, "end": {"x": 2, "y": 3}},
        {"start": {"x": 2, "y": 3}, "end": {"x": 0, "y": 3}},
        {"start": {"x": 0, "y": 3}, "end": {"x": 0, "y": 2}}
      ]
    },
    "9": {
      "id": 9,
      "name": "Juliet",
      "tiles": [{"x": 2, "y": 2}, {"x": 3, "y": 2}],
      "adjacencies": [5, 8, 10, 13],
      "border": [
        {"start": {"x": 2, "y": 2}, "end": {"x": 4, "y": 2}},
        {"start": {"x": 4, "y": 2}, "end": {"x": 4, "y": 3}},
        {"start": {"x": 4, "y": 3}, "end": {"x": 2, "y": 3}},
        {"start": {"x": 2, "y": 3}, "end": {"x": 2, "y": 2}}
      ]
    },
    "10": {
      "id": 10,
      "name": "Kilo",
      "tiles": [{"x": 4, "y": 2}, {"x": 5, "y": 2}],
      "adjacencies": [6, 9, 11, 14],
      "border": [
        {"start": {"x": 4, "y": 2}, "end": {"x": 6, "y": 2}},
        {"start": {"x": 6, "y": 2}, "end": {"x": 6, "y": 3}},
        {"start": {"x": 6, "y": 3}, "end": {"x": 4, "y": 3}},
        {"start": {"x": 4, "y": 3}, "end": {"x": 4, "y": 2}}
      ]
    },
    "11": {
      "id": 11,
      "name": "Lima",
      "tiles": [{"x": 6, "y": 2}, {"x": 7, "y": 2}],
      "adjacencies": [7, 10, 15],
      "border": [
        {"start": {"x": 6, "y": 2}, "end": {"x": 8, "y": 2}},
        {"start": {"x": 8, "y": 2}, "end": {"x": 8, "y": 3}},
        {"start": {"x": 8, "y": 3}, "end": {"x": 6, "y": 3}},
        {"start": {"x": 6, "y": 3}, "end": {"x": 6, "y": 2}}
      ]
    },
    "12": {
      "id": 12,
      "name": "Mike",
      "tiles": [{"x": 0, "y": 3}, {"x": 1, "y": 3}],
      "adjacencies": [8, 13, 16],
      "border": [
        {"start": {"x": 0, "y": 3}, "end": {"x": 2, "y": 3}},
        {"start": {"x": 2, "y": 3}, "end": {"x": 2, "y": 4}},
        {"start": {"x": 2, "y": 4}, "end": {"x": 0, "y": 4}},
        {"start": {"x": 0, "y": 4}, "end": {"x": 0, "y": 3}}
      ]
    },
    "13": {
      "id": 13,
      "name": "November",
      "tiles": [{"x": 2, "y": 3}, {"x": 3, "y": 3}],
      "adjacencies": [9, 12, 14, 17],
      "border": [
        {"start": {"x": 2, "y": 3}, "end": {"x": 4, "y": 3}},
        {"start": {"x": 4, "y": 3}, "end": {"x": 4, "y": 4}},
        {"start": {"x": 4, "y": 4}, "end": {"x": 2, "y": 4}},
        {"start": {"x": 2, "y": 4}, "end": {"x": 2, "y": 3}}
      ]
    },
    "14": {
      "id": 14,
      "name": "Oscar",
      "tiles": [{"x": 4, "y": 3}, {"x": 5, "y": 3}],
      "adjacencies": [10, 13, 15, 18],
      "border": [
        {"start": {"x": 4, "y": 3}, "end": {"x": 6, "y": 3}},
        {"start": {"x": 6, "y": 3}, "end": {"x": 6, "y": 4}},
        {"start": {"x": 6, "y": 4}, "end": {"x": 4, "y": 4}},
        {"start": {"x": 4, "y": 4}, "end": {"x": 4, "y": 3}}
      ]
    },
    "15": {
      "id": 15,
      "name": "Papa",
      "tiles": [{"x": 6, "y": 3}, {"x": 7, "y": 3}],
      "adjacencies": [11, 14, 19],
      "border": [
        {"start": {"x": 6, "y": 3}, "end": {"x": 8, "y": 3}},
        {"start": {"x": 8, "y": 3}, "end": {"x": 8, "y": 4}},
        {"start": {"x": 8, "y": 4}, "end": {"x": 6, "y": 4}},
        {"start": {"x": 6, "y": 4}, "end": {"x": 6, "y": 3}}
      ]
    },
    "16": {
      "id": 16,
      "name": "Quebec",
      "tiles": [{"x": 0, "y": 4}, {"x": 1, "y": 4}],
      "adjacencies": [12, 17],
      "border": [
        {"start": {"x": 0, "y": 4}, "end": {"x": 2, "y": 4}},
        {"start": {"x": 2, "y": 4}, "end": {"x": 2, "y": 5}},
        {"start": {"x": 2, "y": 5}, "end": {"x": 0, "y": 5}},
        {"start": {"x": 0, "y": 5}, "end": {"x": 0, "y": 4}}
      ]
    },
    "17": {
      "id": 17,
      "name": "Romeo",
      "tiles": [{"x": 2, "y": 4}, {"x": 3, "y": 4}],
      "adjacencies": [13, 16, 18],
      "border": [
        {"start": {"x": 2, "y": 4}, "end": {"x": 4, "y": 4}},
        {"start": {"x": 4, "y": 4}, "end": {"x": 4, "y": 5}},
        {"start": {"x": 4, "y": 5}, "end": {"x": 2, "y": 5}},
        {"start": {"x": 2, "y": 5}, "end": {"x": 2, "y": 4}}
      ]
    },
    "18": {
      "id": 18,
      "name": "Sierra",
      "tiles": [{"x": 4, "y": 4}, {"x": 5, "y": 4}],
      "adjacencies": [14, 17, 19],
      "border": [
        {"start": {"x": 4, "y": 4}, "end": {"x": 6, "y": 4}},
        {"start": {"x": 6, "y": 4}, "end": {"x": 6, "y": 5}},
        {"start": {"x": 6, "y": 5}, "end": {"x": 4, "y": 5}},
        {"start": {"x": 4, "y": 5}, "end": {"x": 4, "y": 4}}
      ]
    },
    "19": {
      "id": 19,
      "name": "Tango",
      "tiles": [{"x": 6, "y": 4}, {"x": 7, "y": 4}],
      "adjacencies": [15, 18],
      "border": [
        {"start": {"x": 6, "y": 4}, "end": {"x": 8, "y": 4}},
        {"start": {"x": 8, "y": 4}, "end": {"x": 8, "y": 5}},
        {"start": {"x": 8, "y": 5}, "end": {"x": 6, "y": 5}},
        {"start": {"x": 6, "y": 5}, "end": {"x": 6, "y": 4}}
      ]
    }
  },
  "grid_lookup": [
    [0, 0, 1, 1, 2, 2, 3, 3],
    [4, 4, 5, 5, 6, 6, 7, 7],
    [8, 8, 9, 9, 10, 10, 11, 11],
    [12, 12, 13, 13, 14, 14, 15, 15],
    [16, 16, 17, 17, 18, 18, 19, 19]
  ]
}