{
  "map_name": "test_6_territories",
  "dimensions": {"x": 4, "y": 3},
  "territories": {
    "0": {
      "id": 0,
      "name": "Alpha",
      "tiles": [{"x": 0, "y": 0}, {"x": 1, "y": 0}],
      "adjacencies": [1, 2],
      "border": [
        {"start": {"x": 0, "y": 0}, "end": {"x": 2, "y": 0}},
        {"start": {"x": 2, "y": 0}, "end": {"x": 2, "y": 1}},
        {"start": {"x": 2, "y": 1}, "end": {"x": 0, "y": 1}},
        {"start": {"x": 0, "y": 1}, "end": {"x": 0, "y": 0}}
      ]
    },
    "1": {
      "id": 1, 
      "name": "Beta",
      "tiles": [{"x": 2, "y": 0}, {"x": 3, "y": 0}],
      "adjacencies": [0, 3],
      "border": [
        {"start": {"x": 2, "y": 0}, "end": {"x": 4, "y": 0}},
        {"start": {"x": 4, "y": 0}, "end": {"x": 4, "y": 1}},
        {"start": {"x": 4, "y": 1}, "end": {"x": 2, "y": 1}},
        {"start": {"x": 2, "y": 1}, "end": {"x": 2, "y": 0}}
      ]
    },
    "2": {
      "id": 2,
      "name": "Gamma", 
      "tiles": [{"x": 0, "y": 1}, {"x": 1, "y": 1}],
      "adjacencies": [0, 3, 4],
      "border": [
        {"start": {"x": 0, "y": 1}, "end": {"x": 2, "y": 1}},
        {"start": {"x": 2, "y": 1}, "end": {"x": 2, "y": 2}},
        {"start": {"x": 2, "y": 2}, "end": {"x": 0, "y": 2}},
        {"start": {"x": 0, "y": 2}, "end": {"x": 0, "y": 1}}
      ]
    },
    "3": {
      "id": 3,
      "name": "Delta",
      "tiles": [{"x": 2, "y": 1}, {"x": 3, "y": 1}],
      "adjacencies": [1, 2, 5],
      "border": [
        {"start": {"x": 2, "y": 1}, "end": {"x": 4, "y": 1}},
        {"start": {"x": 4, "y": 1}, "end": {"x": 4, "y": 2}},
        {"start": {"x": 4, "y": 2}, "end": {"x": 2, "y": 2}},
        {"start": {"x": 2, "y": 2}, "end": {"x": 2, "y": 1}}
      ]
    },
    "4": {
      "id": 4,
      "name": "Echo",
      "tiles": [{"x": 0, "y": 2}, {"x": 1, "y": 2}],
      "adjacencies": [2, 5],
      "border": [
        {"start": {"x": 0, "y": 2}, "end": {"x": 2, "y": 2}},
        {"start": {"x": 2, "y": 2}, "end": {"x": 2, "y": 3}},
        {"start": {"x": 2, "y": 3}, "end": {"x": 0, "y": 3}},
        {"start": {"x": 0, "y": 3}, "end": {"x": 0, "y": 2}}
      ]
    },
    "5": {
      "id": 5,
      "name": "Foxtrot", 
      "tiles": [{"x": 2, "y": 2}, {"x": 3, "y": 2}],
      "adjacencies": [3, 4],
      "border": [
        {"start": {"x": 2, "y": 2}, "end": {"x": 4, "y": 2}},
        {"start": {"x": 4, "y": 2}, "end": {"x": 4, "y": 3}},
        {"start": {"x": 4, "y": 3}, "end": {"x": 2, "y": 3}},
        {"start": {"x": 2, "y": 3}, "end": {"x": 2, "y": 2}}
      ]
    }
  },
  "grid_lookup": [
    [0, 0, 1, 1],
    [2, 2, 3, 3], 
    [4, 4, 5, 5]
  ]
}